{
  "id": "saint",
  "type": "outsider",
  "name": {
    "en": "Saint",
    "cn": "圣徒"
  },
  "ability": {
    "en": "If you die by execution, your team loses."
  },
  "flavor_text": {
    "en": "\"Wisdom begets peace. Patience begets wisdom. Fear not, for the time shall come when fear too shall pass. Let us pray, and may the unity of our vision make saints of us all.\""
  },
  "editions": [
    "trouble_brewing"
  ],
  "first_night": false,
  "other_nights": false,
  "artist": "Aidan Roberts",
  "jinxes": [],
  "examples": {
    "en": [
      "There are seven players alive and nominations are in progress. The Saint gets four votes and is about to die. Then, the Baron is nominated but only gets three votes. No more nominations occur today. The Saint is executed, and evil wins.",
      "The Imp is nominated, and the players vote. The Gunslinger kills the Saint. The Saint dies, and the game continues.",
      "The Saint is executed. However, the  Scapegoat's ability is triggered, so the Scapegoat dies instead. The game continues, because the Saint did not die."
    ]
  },
  "tips": {
    "en": [
      "Do not get executed.",
      "No, really. Don't. If you die by execution, the game ends, and your whole team loses. Make sure the good team knows you are the Saint! Tell it in the streets! Tell it from the rooftops! Tell it to everybody! You must be believed to be a good player, or it's curtains. If you have been nominated, cry black and blue that you are the Saint, loudly and publicly... the fate of the game depends on it.",
      "To help prove that you are good, you can arrange for other good players to confirm your identity. Kill players sitting between you and an Empath so that the Empath learns your alignment. Convince the Fortune Teller to select you at night to prove you are not the Demon. Find a Ravenkeeper and get them to agree to choose you so they learn who you are. Get a Slayer to attempt to slay you. The Demon will usually not want to kill you at night, so the question of who you really are will be asked by the group at some stage, and having some players back you up could be crucial.",
      "Alternatively, either stay silent, or bluff as a juicy target for the Demon to attack, such as the Slayer or the Monk. If you die at night, then you remove the possibility of being executed accidentally by the good team. It's only executions that count for your ability.",
      "Find out which other Outsiders are in play. If there are supposed to be two Outsiders in the game, and the only Outsiders to come out publicly are you and the Recluse, for example, then even though you both look inherently suspicious, there are supposed to be two Outsiders in play, so the good team may believe that you are good for this reason alone. If you're the only one, so much the better! It must be you and a Drunk."
    ]
  },
  "how_to_run": {
    "en": "If the Saint dies by execution, declare that the game ends and evil wins."
  },
  "source_url": "https://wiki.bloodontheclocktower.com/Saint"
}