{
  "id": "al_hadikhia",
  "type": "demon",
  "name": {
    "en": "Al Hadikhia",
    "cn": "奥赫"
  },
  "ability": {
    "en": "Each night*, you may choose 3 players (all players learn who): each silently chooses to live or die, but if all live, all die.",
    "cn": "每个夜晚*，你要选择一个角色：他死亡。如果该角色不在场，则由说书人来决定谁会被你杀死。"
  },
  "flavor_text": {
    "en": "\"Alsukut min dhahab.\"",
    "cn": "“如同无月之夜里的篝火那般显眼……我看到你了，凡人。”"
  },
  "editions": [
    "experimental"
  ],
  "first_night": false,
  "other_nights": true,
  "artist": "Marianna Carr",
  "jinxes": [],
  "examples": [
    "奥赫选择了瘟疫医生，瘟疫医生死亡。下一个夜晚，奥赫选择了罂粟种植者，罂粟种植者死亡。再下一个夜晚，奥赫选择了共情者。共情者不在场，因此说书人决定改为让修行者死亡。"
  ],
  "tips": {
    "en": [
      "On the second night, all players will know that an Al-Hadikhia is in play. There is little point generating discussion about which Demon might be in play.",
      "Choose three good players, in order to maximise the number of deaths per night. Good players will often all choose to live, meaning three good players will die. This may hint to the good team that the dead players are actually good, but it's worth it. This strategy is particularly useful if the remaining evil players are all alive, since the evil team will have a significant voting advantage for the rest of the game.",
      "Choose an evil player every so often, to make that evil player look good, or to guarantee at least one death per night. Beginner Al-Hadikhia players may always choose good players, so choosing some evil players, particularly early on, can really help. It is usually best if the two good players that you chose, die, while the single evil player that you chose, lives. But having all three players die is also very helpful, since the final day approaches quicker. Avoid the situation where the two good players live and the evil player dies. The evil player you chose should have a clue as to what the other players are going to choose, to plan their own life accordingly.",
      "Choose yourself at some stage, particularly if all other players have already been chosen previously this game. If you are the single player that has not been chosen by the Al-Hadikhia, that makes you look VERY suspicious. To avoid this, choose yourself one night - just make sure that you choose two other players who are very likely to choose to die, because you will need to choose to live. Talking to a Minion beforehand, and arranging that they will choose to die while you choose to live, guarantees that you will not accidentally kill yourself, since it doesn't matter what the third player chooses.",
      "The more information you have about which characters are in play, the better. Some characters, like the Ravenkeeper, Sage, or Farmer, will want to die at night. Some characters, like the Flowergirl, Balloonist or Poppy Grower will want to stay alive. Some characters, like the Fisherman or Slayer may not be sure if they want to live or die, depending on how useful their ability was or will be. If you know which players are which characters, you can arrange to choose three players that are all likely to live, or all likely to die. Either way, it's helpful.",
      "Choose dead Minions occasionally. You can raise Minions from the dead, and this can be crucial, particularly if they get to use their ability again, such as the Assassin or the Poisoner. Alive Minions can also vote more often - very handy. Be aware of choosing Minions that will telegraph their ability to the good team, such as the Pit-Hag or the Cerenovus. If the public nature of these abilities too obviously let's the good team know which players specifically are Minions, this could cause trouble, outweighing the benefit of another alive Minion.",
      "Choose dead good players occasionally. While it certainly isn't helpful to give Townsfolk players their ability back, these players may look like Minions to the good team, confusing their information. Also, you can be fairly certain that good, dead players will choose to live again, so you can use that to decide which other players to choose. Every life or death decision of a player that you know beforehand, means you can choose players more wisely.",
      "Some players will always choose life at night, out of uncertainty or fear. Where possible, choose three of these types of players all at once at night.",
      "Talk to your Minions. They may be able to provide you with information on who to choose at night, and who not to. This is true even moreso than a regular Demon, because not only are you choosing which characters you want to kill, but you are choosing which combinations of characters. Your Minions may also provide you with information about which character they are, and if they are ok to die at night... and what their story will be afterwards.",
      "If an evil player is chosen at night, even yourself, plan what you are going to say the following day. Having a valid reason for choosing life (or death, as the case may be) is easier when you've thought about it beforehand. Avoid making Minions choose life or death without prior warning, and having to Scramble to come up with reasons for their choice. If you are playing with characters that allow you to die, like the Scarlet Woman, it is also good practice to having your own night-choice and reasons pre-planned."
    ],
    "cn": [
      "优先选择最强力的角色。你的能力的乐趣在于，你可以随心所欲地消灭那些你觉得最具威胁性的角色，所以放开手来结果他们吧！",
      "考虑一下剧本中的其他恶魔——是否值得伪装成其他恶魔可能的行动来进行杀戮？如果你这样做，那意味着你可能不得不放弃优先击杀那些最具威胁性的镇民的做法，但这正是你的能力所在，所以你需要考虑一下是否值得去伪装成其他恶魔。",
      "如果你觉得你的玩法会让玩家发现你是奥赫，请确保你以一个较弱的镇民角色或外来者角色进行伪装。你不会希望在三人决赛圈之前被玩家怀疑为什么你还没有死亡，而其他那些最强力的镇民都已经死了。",
      "伪装成一个强力镇民角色，并让你的爪牙们也这样做！如果游戏中有好几个强力角色都还没死亡，这会让游戏看起来更像不是奥赫在场。同时，你的整个邪恶团队可以借此散播极具影响力的错误信息。",
      "如果你不太确定某名玩家是不是真实地声称了自己的角色，你可以选择这个角色并找出真相。如果他死亡，那很棒，你知道你必须将他的信息纳入你的游戏逻辑中。如果他没有死亡，说明他在伪装，你可以无视他的信息。",
      "注意那些在你的意料之外死亡的玩家。也许他和另一名玩家互通了角色，而实际上他才是你想要杀死的角色。也许你选择的角色并不在场，而他被说书人选中了。",
      "基本上你不应该重复选择同一个角色，除非你想让说书人去进行杀戮！但是请记住，说书人选择目标的设计意图不是为了帮你摆脱困境，所以让说书人选择玩家可能并不是对你们阵营最有帮助的做法。",
      "如果你们的剧本上有恶魔可以在夜晚制造复数死亡，你可以故意选择一个不在场角色（也许是你的伪装之一？），以便说书人制造复数死亡，从而让那些制造复数死亡的恶魔在场的逻辑能够成立。尽管这些杀戮可能比不上你去选择特定角色进行狙击那样有利，但这样做可以保持恶魔角色的不确定性。",
      "别忘了外来者。如果你把所有注意力都集中在击杀镇民上，那么你可能会面临与两名外来者一起进入三人决赛圈的局面，而那两名外来者已经通过外来者数量配置来确证。所以不要忘了，外来者也值得被杀死。",
      "如果你或爪牙想伪装一个没有在初始伪装信息里的角色，你可以在夜晚选择这个角色，通过结果判断它是否在场，并以此调整你的伪装。",
      "如果你是强力角色，你可以声称自己是其他角色，即使你立即死于恶魔的能力。奥赫会通过使用他的能力立即杀死你来获得收益，但如果你令他认为你是某些较为弱势的角色，他会觉得自己选择了一个不在场角色，然后你可以在游戏后期用你的信息来让邪恶玩家大吃一惊。",
      "如果你们发现奥赫在场，你们应该去相信那些早早死亡的强力角色。虽然他们可能没有太多信息，但你们基本上可以确信他们获得的信息，因为奥赫不会让他们产生错误信息。并且，奥赫在场的时候，玩家死在游戏前期这回事，就可以让你们相信他们大概率是好人，并且大概率正是他们自己声称的角色。",
      "通过观察哪些角色死亡来判断奥赫是否在场。如果玩家都按照通常游戏那样死亡——死亡的是那些公开声明自己是强力角色，以及那些根据场上公开或半公开信息可以推断出来是强力角色的玩家，那么这很可能不是奥赫在场。如果死亡的是那些从头到尾都没有公开声明过自己的角色，并且一直游离在玩家信息之外的玩家，那么这可能是奥赫在场。",
      "不要因为在游戏前期死亡的是外来者或不太重要的镇民就放弃奥赫在场的可能性。奥赫可能是在试图摆脱你们的追踪，或可能是意外地选中了不在场角色，然后说书人相应地选择更弱小的目标进行击杀。",
      "注意那些在夜晚死亡的玩家所声称的角色。考虑一下存活玩家之中，谁的游戏思路比较有可能认为当前的死亡顺序最有利于邪恶阵营。如果你的小伙伴是奥赫，他会优先击杀什么角色？这个思路可以帮助你找出谁是真正的奥赫！"
    ]
  },
  "how_to_run": {
    "en": "Each night except the first, wake the Al-Hadikhia. They may point at three players. If they do, mark these players with the 1, 2 and 3 reminders, in the order the Al-Hadikhia chose. Put the Al-Hadikhia to sleep. Wake the player marked 1 and say “The Al-Hadikhia has chosen” then the name of the player, then “Do you choose to live?” They either nod or shake their head. Put them to sleep. If they chose to live, remove their shroud (if any), and if they choose to die, add a shroud. Repeat for players marked 2 then 3. If all three players are alive (none of them have a shroud) then add a shroud to all three. They die. Declare that the time of silence has ended.",
    "cn": "除首个夜晚以外的每个夜晚，唤醒奥赫。让奥赫指向角色列表上的一个角色标记。如果被选择的角色在场，对应的玩家死亡——使用“死亡”提示标记标记那名玩家。如果被选择的角色不在场，那么改为你来选择任意一名玩家，那名玩家死亡——使用“死亡”提示标记标记那名玩家。让奥赫重新入睡。\n如果奥赫所在的剧本包含能够在同一个夜晚进行多次杀戮的恶魔，例如沙巴洛斯，并且奥赫选择了一个不在场的角色，你可以杀死超过一名玩家。这可以帮助奥赫伪装成另一种恶魔。"
  },
  "source_url": "https://wiki.bloodontheclocktower.com/Al-Hadikhia"
}
