{
  "id": "high_priestess",
  "type": "townsfolk",
  "name": {
    "en": "High Priestess"
  },
  "ability": {
    "en": "Each night, learn which player the Storyteller believes you should talk to most."
  },
  "flavor_text": {
    "en": "“There is life behind the personality that uses personalities as masks. There are times when life puts off the mask and deep answers to deep.”"
  },
  "editions": [
    "experimental"
  ],
  "first_night": false,
  "other_nights": true,
  "artist": "Chloe McDougall",
  "jinxes": [],
  "examples": [
    "On the first night, the High Priestess learns Julian. Julian is the Chef and has useful information to share. On the second night, the High Priestess is shown Marianna. Marianna is the Goblin and the Storyteller thinks that the High Priestess would benefit most from talking to Marianna to find this out as early as possible. On the third night, the High Priestess is shown Doug. Doug is the Drunk whose information is wrong and harming the good team.",
    "For three nights in a row, the High Priestess learns Sarah. Sarah is the Saint and the good team are trying to execute her. On the last night, the High Priestess learns Lewis. Lewis is the Imp, and his story is clashing with several good players."
  ],
  "tips": {
    "en": [
      "Talk to the person the Storyteller gives you as soon as possible every day – the Storyteller believes they’re the most important person for you to talk to, so you should get hold of them immediately in order to try to gain trust and use their information to dictate how you should approach the rest of your day.",
      "Don’t talk to your given player immediately. Instead, observe who they talk to and see if you can gain any clues as to why you should be talking to them from how they’re behaving and interacting. If they’re especially eager to talk to a couple of specific other people, maybe they’re a Washerwoman or Fortune Teller, for example, and knowing this might dictate how you approach them. Or they might seem slightly lost up until they speak to a specific other players and could be a Minion who just received bluffs.",
      "Tell the person you saw that you’re the High Priestess and learnt them, see if they know a good reason why they might have been shown. Your information can be very nebulous but it’s possible that the player you saw has good theories based on whatever they’ve gained from their own character as to what they can offer to you and to the good team more widely.",
      "Don’t tell that person that you’re the High Priestess, the Storyteller may not be intending for you to share all of your information with this player, only for them to potentially have things to say that might help you.",
      "On the first night, the player you learn is most likely either a good player who already has information so that they can share it with you or a Minion who you might be able to get a social read from or trap without a bluff.",
      "As the game goes on, the Storyteller is most likely to point you towards players that have information they haven’t fully shared yet (even if that information is just their character), dead players that need to know other information you’ve garnered or evil players who can’t further their agenda if they’re in a conversation with you rather than their evil fellows or the players they’re attempting to manipulate.",
      "In the late game the Storyteller is most likely to direct you to good players who are on the right track, to encourage you to convert to their perspective and reinforce their mentality to the group, or the Demon so you can try to pick holes in their arguments and push back on their claims.",
      "If the good team is winning, the Storyteller will likely be directing you to players to reinforce that winning strategy. If not, they may be pointing you to contradictory information to try to draw your attention to alternate views and encourage you to abandon your previously strongly held views. How do you feel the game is going for the good team? Consider your information in this context at all times!",
      "Did the Storyteller give you the same player twice in a row? Most likely what the ST wanted you to get from that conversation didn’t happen, so try again with an open mind!",
      "At the end of the day, the High Priestess is a great value-add even if you don’t work out exactly why the Storyteller sent you to any given player. Even if all you do is just go and talk to your given player each day and never work out why, you’re talking to the people the Storyteller recommends and that can only turn out usefully for the good team."
    ]
  },
  "how_to_run": {
    "en": "Each night, wake the High Priestess. Point to a player. Put the High Priestess to sleep."
  },
  "source_url": "https://wiki.bloodontheclocktower.com/High_Priestess",
  "image": "assets/tokens/high_priestess.png"
}